{
  "$schema": "https://json-schema.org/draft/2020-12/schema",
  "$id": "scope.schema.json",
  "title": "Ficha de alcance WCAG-EM",
  "type": "object",
  "additionalProperties": false,
  "required": [
    "schemaVersion",
    "auditId",
    "product",
    "standard",
    "included",
    "excluded",
    "baseline",
    "assumptions",
    "openQuestions",
    "status"
  ],
  "properties": {
    "schemaVersion": { "const": 1 },
    "auditId": { "type": "string", "pattern": "^[a-z0-9-]+$" },
    "product": {
      "type": "object",
      "additionalProperties": false,
      "required": ["name", "description", "startUrl"],
      "properties": {
        "name": { "type": "string", "minLength": 1 },
        "description": { "type": "string", "minLength": 1 },
        "startUrl": { "type": "string", "minLength": 1 }
      }
    },
    "standard": {
      "type": "object",
      "additionalProperties": false,
      "required": ["wcagVersion", "level"],
      "properties": {
        "wcagVersion": { "const": "2.2" },
        "level": { "enum": ["A", "AA", "AAA"] }
      }
    },
    "included": {
      "type": "array",
      "minItems": 1,
      "items": { "type": "string", "minLength": 1 },
      "uniqueItems": true
    },
    "excluded": {
      "type": "array",
      "items": {
        "type": "object",
        "additionalProperties": false,
        "required": ["item", "reason"],
        "properties": {
          "item": { "type": "string", "minLength": 1 },
          "reason": { "type": "string", "minLength": 1 }
        }
      }
    },
    "baseline": {
      "type": "array",
      "minItems": 1,
      "items": { "type": "string", "minLength": 1 },
      "uniqueItems": true
    },
    "assumptions": {
      "type": "array",
      "items": { "type": "string", "minLength": 1 },
      "uniqueItems": true
    },
    "openQuestions": {
      "type": "array",
      "items": { "type": "string", "minLength": 1 },
      "uniqueItems": true
    },
    "status": { "enum": ["draft", "approved"] },
    "approvedBy": { "type": "string", "minLength": 1 },
    "approvedAt": {
      "type": "string",
      "pattern": "^\\d{4}-\\d{2}-\\d{2}T\\d{2}:\\d{2}:\\d{2}(?:\\.\\d+)?Z$"
    }
  },
  "allOf": [
    {
      "if": { "properties": { "status": { "const": "approved" } } },
      "then": { "required": ["approvedBy", "approvedAt"] }
    }
  ]
}
