{
  "schemaVersion": 1,
  "auditId": "valid-audit",
  "product": {
    "name": "CityLights",
    "description": "Página pública usada para comprobar el harness.",
    "startUrl": "https://weaaare.github.io/curso-auditor-accesibilidad-con-ia/"
  },
  "standard": {
    "wcagVersion": "2.2",
    "level": "AA"
  },
  "included": ["Inicio y navegación desplegada"],
  "excluded": [],
  "baseline": ["Chromium de escritorio a 1280 × 720"],
  "assumptions": [],
  "openQuestions": [],
  "status": "approved",
  "approvedBy": "Prueba automatizada",
  "approvedAt": "2026-08-20T12:00:00Z"
}
